{
  "$schema": "https://json-schema.org/draft/2020-12/schema",
  "title": "Survey autonomous engineering run state",
  "description": "Version 2 wire contract with read compatibility for strict version 1 records; transition, HEAD and evidence checks are enforced by the state and gate layers.",
  "type": "object",
  "additionalProperties": false,
  "required": [
    "schemaVersion",
    "runId",
    "planPath",
    "planSha256",
    "worktreePath",
    "branch",
    "baseCommit",
    "headCommit",
    "milestoneId",
    "milestoneTitle",
    "status",
    "attempts",
    "lastFailureFingerprint",
    "requiredGates",
    "gates",
    "changedPaths",
    "decisions",
    "createdAt",
    "updatedAt"
  ],
  "properties": {
    "schemaVersion": {
      "type": "integer",
      "enum": [1, 2]
    },
    "runId": {
      "type": "string",
      "format": "uuid",
      "pattern": "^[0-9a-f]{8}-[0-9a-f]{4}-[0-9a-f]{4}-[0-9a-f]{4}-[0-9a-f]{12}$"
    },
    "planPath": {
      "type": "string",
      "minLength": 1,
      "pattern": "^(?!/)(?![A-Za-z]:)(?!.*\\\\)(?!.*(?:^|/)\\.\\.(?:/|$))[^\\u0000]+$"
    },
    "planSha256": {
      "type": "string",
      "pattern": "^[0-9a-f]{64}$"
    },
    "worktreePath": {
      "type": "string",
      "pattern": "^/[^\\u0000]+$"
    },
    "branch": {
      "type": "string",
      "minLength": 1
    },
    "baseCommit": {
      "type": "string",
      "pattern": "^[0-9a-f]{40}$"
    },
    "headCommit": {
      "type": "string",
      "pattern": "^[0-9a-f]{40}$"
    },
    "milestoneId": {
      "type": "string",
      "minLength": 1
    },
    "milestoneTitle": {
      "type": "string",
      "minLength": 1
    },
    "status": {
      "enum": [
        "planned",
        "active",
        "verifying",
        "repairing",
        "completed",
        "paused",
        "blocked"
      ]
    },
    "attempts": {
      "type": "object",
      "additionalProperties": false,
      "required": [
        "total",
        "byFingerprint"
      ],
      "properties": {
        "total": {
          "type": "integer",
          "minimum": 0
        },
        "byFingerprint": {
          "type": "object",
          "propertyNames": {
            "type": "string",
            "pattern": "^[0-9a-f]{64}$"
          },
          "additionalProperties": {
            "type": "integer",
            "minimum": 0
          }
        }
      }
    },
    "lastFailureFingerprint": {
      "anyOf": [
        {
          "type": "string",
          "pattern": "^[0-9a-f]{64}$"
        },
        {
          "type": "null"
        }
      ]
    },
    "requiredGates": {
      "type": "array",
      "items": {
        "type": "string",
        "minLength": 1
      },
      "uniqueItems": true
    },
    "gates": {
      "type": "object",
      "propertyNames": {
        "type": "string",
        "minLength": 1
      },
      "additionalProperties": {
        "type": "object",
        "additionalProperties": false,
        "required": [
          "gateId",
          "status",
          "exitCode",
          "startedAt",
          "endedAt",
          "evidencePath",
          "headCommit"
        ],
        "properties": {
          "gateId": {
            "type": "string",
            "minLength": 1
          },
          "status": {
            "enum": [
              "pending",
              "running",
              "passed",
              "failed",
              "timed_out"
            ]
          },
          "exitCode": {
            "anyOf": [
              {
                "type": "integer"
              },
              {
                "type": "null"
              }
            ]
          },
          "startedAt": {
            "anyOf": [
              {
                "type": "string",
                "format": "date-time",
                "pattern": "^\\d{4}-\\d{2}-\\d{2}T\\d{2}:\\d{2}:\\d{2}(?:\\.\\d+)?Z$"
              },
              {
                "type": "null"
              }
            ]
          },
          "endedAt": {
            "anyOf": [
              {
                "type": "string",
                "format": "date-time",
                "pattern": "^\\d{4}-\\d{2}-\\d{2}T\\d{2}:\\d{2}:\\d{2}(?:\\.\\d+)?Z$"
              },
              {
                "type": "null"
              }
            ]
          },
          "evidencePath": {
            "anyOf": [
              {
                "type": "string",
                "minLength": 1,
                "pattern": "^(?!/)(?![A-Za-z]:)(?!.*\\\\)(?!.*(?:^|/)\\.\\.(?:/|$))[^\\u0000]+$"
              },
              {
                "type": "null"
              }
            ]
          },
          "headCommit": {
            "type": "string",
            "pattern": "^[0-9a-f]{40}$"
          },
          "summaryPath": {
            "anyOf": [
              {
                "type": "string",
                "minLength": 1,
                "pattern": "^(?!/)(?![A-Za-z]:)(?!.*\\\\)(?!.*(?:^|/)\\.\\.(?:/|$))[^\\u0000]+$"
              },
              {"type": "null"}
            ]
          },
          "evidenceKey": {
            "anyOf": [
              {"type": "string", "pattern": "^[0-9a-f]{64}$"},
              {"type": "null"}
            ]
          },
          "source": {
            "enum": ["local", "github", "reused"]
          },
          "reused": {
            "type": "boolean"
          },
          "diagnosticBytes": {
            "type": "integer",
            "minimum": 0,
            "maximum": 49152
          }
        },
        "allOf": [
          {
            "if": {
              "properties": {
                "status": {
                  "const": "passed"
                }
              },
              "required": [
                "status"
              ]
            },
            "then": {
              "properties": {
                "exitCode": {
                  "const": 0
                },
                "startedAt": {
                  "type": "string",
                  "format": "date-time",
                  "pattern": "^\\d{4}-\\d{2}-\\d{2}T\\d{2}:\\d{2}:\\d{2}(?:\\.\\d+)?Z$"
                },
                "endedAt": {
                  "type": "string",
                  "format": "date-time",
                  "pattern": "^\\d{4}-\\d{2}-\\d{2}T\\d{2}:\\d{2}:\\d{2}(?:\\.\\d+)?Z$"
                },
                "evidencePath": {
                  "type": "string",
                  "minLength": 1,
                  "pattern": "^(?!/)(?![A-Za-z]:)(?!.*\\\\)(?!.*(?:^|/)\\.\\.(?:/|$))[^\\u0000]+$"
                }
              }
            }
          }
        ]
      }
    },
    "changedPaths": {
      "type": "array",
      "items": {
        "type": "string",
        "minLength": 1,
        "pattern": "^(?!/)(?![A-Za-z]:)(?!.*\\\\)(?!.*(?:^|/)\\.\\.(?:/|$))[^\\u0000]+$"
      },
      "uniqueItems": true
    },
    "decisions": {
      "type": "array",
      "items": {
        "type": "object",
        "additionalProperties": false,
        "required": [
          "type",
          "summary",
          "createdAt"
        ],
        "properties": {
          "type": {
            "type": "string",
            "minLength": 1
          },
          "summary": {
            "type": "string",
            "minLength": 1
          },
          "createdAt": {
            "type": "string",
            "format": "date-time",
            "pattern": "^\\d{4}-\\d{2}-\\d{2}T\\d{2}:\\d{2}:\\d{2}(?:\\.\\d+)?Z$"
          }
        }
      }
    },
    "createdAt": {
      "type": "string",
      "format": "date-time",
      "pattern": "^\\d{4}-\\d{2}-\\d{2}T\\d{2}:\\d{2}:\\d{2}(?:\\.\\d+)?Z$"
    },
    "updatedAt": {
      "type": "string",
      "format": "date-time",
      "pattern": "^\\d{4}-\\d{2}-\\d{2}T\\d{2}:\\d{2}:\\d{2}(?:\\.\\d+)?Z$"
    }
  }
}
